{"$schema":"https://json-schema.org/draft/2020-12/schema","$id":"https://salus.example/schemas/uc3/artifact_manifest.schema.json","type":"object","additionalProperties":false,"required":["schema_version","use_case","generated_at","artifact_count","artifacts"],"properties":{"schema_version":{"const":"1.0.0"},"use_case":{"const":"UC3"},"generated_at":{"type":"string"},"artifact_count":{"type":"integer","minimum":0},"artifacts":{"type":"array","items":{"type":"object","additionalProperties":false,"required":["path","bytes","sha256"],"properties":{"path":{"type":"string"},"bytes":{"type":"integer","minimum":0},"sha256":{"type":"string","pattern":"^[a-f0-9]{64}$"}}}}}}
