{
  "artifact_count": 114,
  "artifacts": [
    {
      "bytes": 83,
      "path": ".gitignore",
      "sha256": "e528d126bceb85dcdfd5d32a9fc64a563b256e363be5df1ff073e7bf513ce6d4"
    },
    {
      "bytes": 276,
      "path": "CHANGELOG.md",
      "sha256": "a4d3ef26a8254cc7561a473756bd7d0bdc33ed764cc6298e5ee75f4be866a396"
    },
    {
      "bytes": 1358,
      "path": "README.md",
      "sha256": "7a0045076dfbabd3fd36c8a20def547db4bd310f335523fe5d2458f514ad6d55"
    },
    {
      "bytes": 1471,
      "path": "configs/uc3/baseline.yaml",
      "sha256": "068927c1955940589ccb5ab6ccf2254bc4e731d8b7bf73281a2c0ee1ebf27191"
    },
    {
      "bytes": 1634,
      "path": "configs/uc3/experiments.yaml",
      "sha256": "6ce04c6c3697f1feb8f0a52d9042f5737aabd11289cce265472bf8c0d695349e"
    },
    {
      "bytes": 359,
      "path": "configs/uc3/monte_carlo.yaml",
      "sha256": "4b4d656b4bf03d2aafe9dd40c8888f94eee274701a87d2692e29f79e2e9290a8"
    },
    {
      "bytes": 30,
      "path": "configs/uc3/schema_migrations.yaml",
      "sha256": "617206b9667fa4620c1a19f0b0bfd2dec199c8fcbf28de4133c436601f46e20d"
    },
    {
      "bytes": 58,
      "path": "configs/uc3/schema_version.yaml",
      "sha256": "2908437015092fbed4c52738a2c2555534d6397aaec44f5b5df3c60e24984dca"
    },
    {
      "bytes": 1518,
      "path": "configs/uc3/smart_fuzzing_attack.yaml",
      "sha256": "2a4a7ac0371a1847dfbb324302342d9b2961ff71489699ac5fae2bfe90669b3b"
    },
    {
      "bytes": 2396,
      "path": "contracts/integration/uc3_integration_contracts.yaml",
      "sha256": "f17159668efbe96cd1e90587383c37ce1ee39ed7fc255c3f526a4035ab8048b3"
    },
    {
      "bytes": 1574,
      "path": "data/inventory/device_inventory.csv",
      "sha256": "84c7b5005f7bd1b010c3a8d6d04321ef4b36043f37913b374afa09aef5c99d17"
    },
    {
      "bytes": 642,
      "path": "data/inventory/uc3_dataset_field_mapping.csv",
      "sha256": "e1d5107a5f0d556b133feb3d266c3ab8996cd281e878faab02f1bd14d618ad9d"
    },
    {
      "bytes": 1226,
      "path": "data/inventory/uc3_entity_inventory.csv",
      "sha256": "3cdf77f98d7032766bf39d6755ecc69eeb71e7de6104eb6162da3ab9de508868"
    },
    {
      "bytes": 0,
      "path": "data/processed/uc3/.gitkeep",
      "sha256": "e3b0c44298fc1c149afbf4c8996fb92427ae41e4649b934ca495991b7852b855"
    },
    {
      "bytes": 365,
      "path": "data/processed/uc3/README.md",
      "sha256": "06180de68669de0f87958a6659988a97af0a4e3ef95048675b337ff7ec5aeacc"
    },
    {
      "bytes": 518,
      "path": "data/raw/uc3/README.md",
      "sha256": "50f28ccc5e07c7dfbd565c5453c5baba91151e96c2959acfd1b1394fc6d643cb"
    },
    {
      "bytes": 0,
      "path": "data/synthetic/uc3/.gitkeep",
      "sha256": "e3b0c44298fc1c149afbf4c8996fb92427ae41e4649b934ca495991b7852b855"
    },
    {
      "bytes": 431,
      "path": "data/synthetic/uc3/README.md",
      "sha256": "453c5f36f17a2a5178ffbb34416218c4ac411a26f26dc4301984b92867b857d7"
    },
    {
      "bytes": 565,
      "path": "diagrams/entity_relationships/UC3_entity_relationships.md",
      "sha256": "6fb5e1fca7c6778624a78d3fedfc365590927b542041135bfc1952372887a35e"
    },
    {
      "bytes": 1346,
      "path": "diagrams/process_flows/UC3_detection_explanation.bpmn",
      "sha256": "a1844020739acb93a84d092b0e1cf089f122b90746c1cedca99013752cff1e37"
    },
    {
      "bytes": 1451,
      "path": "diagrams/process_flows/UC3_evidence_investigation.bpmn",
      "sha256": "84a68263b4e036604abbcd8a5a864b603843f8251c1f31158e7ad29398029097"
    },
    {
      "bytes": 772,
      "path": "diagrams/process_flows/UC3_normal_operation.bpmn",
      "sha256": "2be232e8d9ef26b81af3b0019a30fa96235c1039c99cf959ad1729edbaa6a3b8"
    },
    {
      "bytes": 1326,
      "path": "diagrams/process_flows/UC3_safety_constrained_mitigation.bpmn",
      "sha256": "d69fafd1c55a87c2a98f8f89129b6cf4b254aadf460b906154437f18147a720b"
    },
    {
      "bytes": 1398,
      "path": "diagrams/process_flows/UC3_smart_fuzzing_attack.bpmn",
      "sha256": "60883009f5cb2ad767db7f452c9a96fd1bec94cb7a9399e2c5e833e2d4738d9a"
    },
    {
      "bytes": 1376,
      "path": "diagrams/process_flows/UC3_supply_chain_assessment.bpmn",
      "sha256": "b70bc95ae88a64fc4203794d5b24d4de3e0137d1284fdf4d4b9bb3ac7dd3bb9d"
    },
    {
      "bytes": 1068,
      "path": "diagrams/process_flows/UC3_system_collaboration.bpmn",
      "sha256": "545ed287923e5f793e4adf2a667646594d0f065091ab13ef53fac1c74a066ca9"
    },
    {
      "bytes": 1081,
      "path": "diagrams/state_machines/UC3_entity_lifecycles.bpmn",
      "sha256": "8edee07e8fb6a9b3851bd66a70c6937aa094c4f34023a18bf83fd26a42a3445d"
    },
    {
      "bytes": 641,
      "path": "docs/00_task_scope.md",
      "sha256": "e62ca73686fa0f09d3a26014e50391af784200b953f8ef7703fbedf2e07982d2"
    },
    {
      "bytes": 745,
      "path": "docs/01_use_case_analysis.md",
      "sha256": "1533135e1237faf7099ee7a06a3c21ffd6e562e60d7ba170d41eaab9cfe7fca5"
    },
    {
      "bytes": 662,
      "path": "docs/02_entity_model.md",
      "sha256": "fbc214ff2e3e5b538bfcf0c116e2487648d7812fc74e1f2ff946f5af49d112a4"
    },
    {
      "bytes": 602,
      "path": "docs/03_process_model.md",
      "sha256": "8e2d8ece8c765d674ef66d3a99d1f259bf64d90960ff70b513a3d24ca4e44c25"
    },
    {
      "bytes": 579,
      "path": "docs/04_validation_plan.md",
      "sha256": "53abd5e22eb6a23932a31b5349b8caca06326a107bb9be77eaba54f4eabbec9a"
    },
    {
      "bytes": 544,
      "path": "docs/analysis/UC3_metrics_and_sensitivity.md",
      "sha256": "8e0eaf8045a91c0c458d8480eaf43f3b69f5a7326cbd17678c6e6a4c09b15231"
    },
    {
      "bytes": 2446,
      "path": "docs/assumptions/UC3_assumptions.md",
      "sha256": "9723e0f932fb8b5f8b15e62f00245ea2dee43fc15cd176808646e8d35cface3e"
    },
    {
      "bytes": 464,
      "path": "docs/graph/UC3_graph_queries.md",
      "sha256": "b5b4b90cd784bb3336614f8516bba339b6231b39d4bd84b232085b77fca100de"
    },
    {
      "bytes": 453,
      "path": "docs/integration/UC3_integration_contracts.md",
      "sha256": "8a70598cf71f8fec897261cb0331194a81a737ea426f6d64e3629e062e8621ca"
    },
    {
      "bytes": 340,
      "path": "docs/packaging/DEPENDENCY_LOCK.md",
      "sha256": "abda54a0638a62da8a5efacf8e8f7f6f526b892caac908ec8364ea20a093cdcf"
    },
    {
      "bytes": 656,
      "path": "docs/processes/UC3_lifecycles.md",
      "sha256": "2abd48f8095f43c9bb781501b8dd5c00ce10ea9229fff7a04e9ae66b13f1df54"
    },
    {
      "bytes": 1087,
      "path": "docs/processes/UC3_processes.md",
      "sha256": "c5d126038e8ee76922983229e84153aeb5faa729a7041f0d12013cdfd07e0df7"
    },
    {
      "bytes": 617,
      "path": "docs/simulation/UC3_simulation.md",
      "sha256": "e2b1425606ddcf891d38500d5061a6e56c03f8a1eac429f79ea5e2fe88bba124"
    },
    {
      "bytes": 1124,
      "path": "docs/use_cases/UC3.md",
      "sha256": "4cff62406212e2d0dd460e88984c71df7b3ea1a662b4e8489c7a95b5276c7a9d"
    },
    {
      "bytes": 2353,
      "path": "models/formal/uc3_mathematical_model.md",
      "sha256": "c9662fde4d237463dc897e9b409c2b670d14c7bb5e23c44be6f1c062741c8017"
    },
    {
      "bytes": 43733,
      "path": "models/graph/uc3_graph.json",
      "sha256": "e54c4cf1ce6c80cb7d62359c1c1b10f0b01e70e90ceccde1989c95ca8fc7efee"
    },
    {
      "bytes": 15970,
      "path": "models/instances/uc3_entities.json",
      "sha256": "611e39b4bfd06fa5ec1fdfc2c88930c6060f6bebff3499147a964278959f209b"
    },
    {
      "bytes": 6485,
      "path": "models/relationships/uc3_relationships.csv",
      "sha256": "dbd79d5ea04a01c7479ab53528fe4e5ffe69dc08110c27e42e6bcee3cf6cbb5d"
    },
    {
      "bytes": 673,
      "path": "models/schemas/artifact_manifest.schema.json",
      "sha256": "14c28e9d90417b8d41ab7a199a68e975bbcc0a34a8167c241b3f1106b49a7ea9"
    },
    {
      "bytes": 398,
      "path": "models/schemas/entities/devices/README.md",
      "sha256": "7b142c004882d3ea76e3958cd5731f42a5547ac5b9f31aa523045f7da603a9ad"
    },
    {
      "bytes": 1493,
      "path": "models/schemas/entity.schema.json",
      "sha256": "54ec902bb1e7ea89d3b42fafbc81d8b4223db40bd0b75ef5f32e9d3850e96874"
    },
    {
      "bytes": 384,
      "path": "models/schemas/entity_collection.schema.json",
      "sha256": "133c44fc309649e3602042674d166209cf1259c9b2b6977251929bab2dc58fd5"
    },
    {
      "bytes": 773,
      "path": "models/schemas/event.schema.json",
      "sha256": "87ce557363653e450f92b9383646030c8a4fdab0ed305beffbbff1f9913b49e1"
    },
    {
      "bytes": 492,
      "path": "models/schemas/evidence.schema.json",
      "sha256": "5d4e07fe24d1df4f977d569f48d8354380ae0063a95446c26ade477b3a29a3f6"
    },
    {
      "bytes": 796,
      "path": "models/schemas/integration_contracts.schema.json",
      "sha256": "303f88783fecf8e33bb6888ceb2d6d6b8e4234f16cbc4c3eca9292736a706b80"
    },
    {
      "bytes": 1057,
      "path": "models/schemas/relationship.schema.json",
      "sha256": "c56927a1b1b1b3a61975be832ee5d70969889b5a5da26d2cc832042c9de14792"
    },
    {
      "bytes": 356,
      "path": "models/schemas/runtime_graph.schema.json",
      "sha256": "4bdda621b1647da348a471ccdb33ec83cec7c4619a16e9a110981b2d977b67e8"
    },
    {
      "bytes": 792,
      "path": "models/schemas/simulation_config.schema.json",
      "sha256": "040fe8ef2d937b4e3a3db234d3da20ecec728cfca462ff3b08636821530299b5"
    },
    {
      "bytes": 630,
      "path": "pyproject.toml",
      "sha256": "3776bdba8edda9f561948ddfd58661e96c1c2848f7b6ea21c7820a701709e31f"
    },
    {
      "bytes": 978,
      "path": "reports/final/UC3_final_handoff.md",
      "sha256": "664b62e88a90b59c0295bd53bf1ccc43fbc36e64716495057554fb44f5d9a14c"
    },
    {
      "bytes": 3763,
      "path": "reports/generated/uc3/experiments/experiment_comparison.json",
      "sha256": "e9bd59fc733d7835cb564496ea6072bdc3e23baf2e58415f4fc1a70a92e07717"
    },
    {
      "bytes": 527,